example_id,text,context,true_label,pred_original,pred_normalized,correct_original,correct_normalized,flip_direction,tier,model_type,classifier,input_type,pooling,dataset
3,"BERNADETTE: Wow, you still have it? I just assumed it was balled up in the corner of a barn somewhere.","PENNY: I don't suppose you also brought napkins, clean bowls, utensils and a roll of toilet paper. | BERNADETTE: Right here. | PENNY: You guys are the best. | AMY: What's with the clothes? | PENNY: Well, with all the new stuff I bought for work, I needed to make room in my closet. | AMY: I meant why are they folded? 
But whatever. | AMY: Ooh, what's this? | PENNY: That, believe it or not, is my prom dress.",1,0,1,0,1,norm_helps,tier3,xlmr,logreg,text_only,mean,test
6,JOEY: It's that whole sensitive thing.,"JOEY: It's gonna be worth it. It's a known fact that women love babies, all right? Women love guys who love babies.",0,0,1,1,0,norm_hurts,tier3,xlmr,logreg,text_only,mean,test
14,ROSS: We- we had our first fight this morning.,MONICA: Do you always have to bring him here? | ROSS: I didn't wanna leave him alone. Alright?,0,0,1,1,0,norm_hurts,tier3,xlmr,logreg,text_only,mean,test
17,HOWARD: Why don't you keep that stuff in the bathroom?,"RAJ: That's a great idea. I'm going to get him to sign a Batman as well. | SHELDON: What is it about the word ""unique"" you don't understand? | HOWARD: Damn, paper cut. Nothing worse than a paper cut. | RAJ: Well, obviously you don't remember your circumcision. | SHELDON: There's Neosporin and Band-Aids in my top desk drawer.",0,1,0,0,1,norm_helps,tier3,xlmr,logreg,text_only,mean,test
35,LEONARD: And I'm cool with surprises. But nothing on a Jumbotron. I don't want to cry on a big screen like that.,"LEONARD: But if someday you decide you want to get married, you have to propose to me. | PENNY: Really? | LEONARD: Yes. It's all on you. | LEONARD: But I got to tell you, when the time comes, I want the whole nine yards. | LEONARD: I want you down on one knee, flowers.
I want to be swept off my feet. | PENNY: Yeah, you got it.",0,1,0,0,1,norm_helps,tier3,xlmr,logreg,text_only,mean,test
47,RAJ: I did. The guy at the liquor store said this stuff tastes great in coffee.,HOWARD: Do you really think you should be drinking right now? | RAJ: How else am I supposed to talk to the Human Resources lady? | HOWARD: I don't know. Seek professional help?,0,0,1,1,0,norm_hurts,tier3,xlmr,logreg,text_only,mean,test
50,"JOEY: It's white plastic, with a handle, and it fits onto a stroller.","CHANDLER: I'm doing research for a book, and I was wondering what someone might do if they left a baby on a city bus. | JOEY: Hi, here's the deal. We lost a carseat on a bus today.",0,0,1,1,0,norm_hurts,tier3,xlmr,logreg,text_only,mean,test
51,"JOEY: I'd love to show ya, but I just tucked her in.",PERSON: Hi Joey. | JOEY: Hey! How you doin'? | PERSON: He has the most amazing Porsche under there!,0,0,1,1,0,norm_hurts,tier3,xlmr,logreg,text_only,mean,test
53,"CHANDLER: Well, I'm a headhunter. I hook up out of work Soviet scientists with rogue third-world nations. Hi Rasputin!","ROSS: Hi Ben, and uh .. | JOEY: I said ""a little bit"" Ross.",1,0,1,0,1,norm_helps,tier3,xlmr,logreg,text_only,mean,test
